season,episode,timestamp,description
2,15,11:26,"<pre>Shawn: I know, and that's why I'm here to offer our services.
Lassie: I'd rather shower with a bear.</pre>"
4,8,8:13,"<pre>Shawn: You sure you don't want to tag along?
Lassie: I would rather adopt a child.</pre>"
4,15,32:56,"<pre>Juliet: Look at this letter I found in the courier from last month.
Lassie: The courier? No. I would rather french-kiss a hobo than read anything in that rag.</pre>"
5,14,26:45,"<pre>Shawn: Now, come on, let's hug it out.
Lassie: I would rather fall in love with a vegan.</pre>"
6,3,27:49,"<pre>Shawn: I'm sorry, come on. Let's hug it out.
Lassie: I would rather learn to play the harp.</pre>"
6,4,35:59,"<pre>Shawn: Oh, come on. You might like it if you try it.
Lassie: I would rather spend the rest of my life at Lilith Fair.</pre>"
7,3,13:48,"<pre>Gus: Come on, hug it out. Hug it out.
Lassie: I would rather spend all day at the mall with McNab.</pre>"
